{
    "userId": 442110365,
    "authorName": "Daniel Seo",
    "from": "Daniel Seo &lt;DigimonDaniel0907@...&gt;",
    "profile": "digimondaniel0907",
    "replyTo": "LIST",
    "senderId": "r9qBHz2vbTNHjvA7IqHEwIdMvJRowJVhmtVgv9fR34xVq0fDAgwE3ouQbtn7FZDjzKtLbYUpU1UiPw4EJCUb6tdfpOHuOw1bDuB18Sg_hQ",
    "spamInfo": {
        "isSpam": false,
        "reason": "12"
    },
    "subject": "thank you",
    "postDate": "1272304075",
    "msgId": 10179,
    "canDelete": false,
    "contentTrasformed": false,
    "systemMessage": true,
    "headers": {
        "messageIdInHeader": "PG0ycDdmNWQ5NDI1MTAwNDI2MTA0N21mMjA3MzU4dzU5YjNlYzViOTQ0YjgyOWVAbWFpbC5nbWFpbC5jb20+"
    },
    "prevInTopic": 0,
    "nextInTopic": 0,
    "prevInTime": 10178,
    "nextInTime": 10180,
    "topicId": 10179,
    "numMessagesInTopic": 1,
    "msgSnippet": "thank you  for answered my questions........ you helped my samurai research project......... thank you again [Non-text portions of this message have been",
    "rawEmail": "Return-Path: &lt;digimondaniel0907@...&gt;\r\nReceived: (qmail 29255 invoked from network); 27 Apr 2010 02:29:35 -0000\r\nReceived: from unknown (66.196.94.107)\n  by m13.grp.re1.yahoo.com with QMQP; 27 Apr 2010 02:29:35 -0000\r\nReceived: from unknown (HELO n43d.bullet.mail.sp1.yahoo.com) (66.163.169.157)\n  by mta3.grp.re1.yahoo.com with SMTP; 27 Apr 2010 02:29:35 -0000\r\nDKIM-Signature: v=1; a=rsa-sha256; c=relaxed/relaxed; d=yahoogroups.com; s=lima; t=1272335170; bh=AJBF3lFmXfTkaIV04jRbFXwHjQkSgxbViKYSlKr2RUo=; h=Received:Received:X-Sender:X-Apparently-To:X-Received:X-Received:X-Received:X-Received:MIME-Version:X-Received:X-Received:Date:Message-ID:To:X-Originating-IP:X-eGroups-Msg-Info:From:Subject:X-Yahoo-Group-Post:X-Yahoo-Profile:Content-Type:Content-Transfer-Encoding:X-YGroups-SubInfo:Sender:X-Yahoo-Newman-Property:X-eGroups-Approved-By:X-eGroups-Auth; b=shs1oI1aAusPL6TTw6hTw6GLuxXoCztCtAnX+cFAGLpQXVXN0H5bIwCIPqqoJJRo3SPsjkYy1PrCidRUqFMYJpojIQ+4yDNbPEWG4aJk04tvsJWaMCZ4h8atpypOTfnb\r\nReceived: from [69.147.65.174] by n43.bullet.mail.sp1.yahoo.com with NNFMP; 27 Apr 2010 02:26:10 -0000\r\nReceived: from [98.137.34.34] by t12.bullet.mail.sp1.yahoo.com with NNFMP; 27 Apr 2010 02:26:10 -0000\r\nX-Sender: digimondaniel0907@...\r\nX-Apparently-To: samuraihistory@yahoogroups.com\r\nX-Received: (qmail 71648 invoked from network); 26 Apr 2010 17:47:56 -0000\r\nX-Received: from unknown (66.196.94.107)\n  by m10.grp.re1.yahoo.com with QMQP; 26 Apr 2010 17:47:56 -0000\r\nX-Received: from unknown (HELO mail-pz0-f196.google.com) (209.85.222.196)\n  by mta3.grp.re1.yahoo.com with SMTP; 26 Apr 2010 17:47:56 -0000\r\nX-Received: by mail-pz0-f196.google.com with SMTP id 34so5835099pzk.33\n        for &lt;samuraihistory@yahoogroups.com&gt;; Mon, 26 Apr 2010 10:47:56 -0700 (PDT)\r\nMIME-Version: 1.0\r\nX-Received: by 10.114.236.22 with SMTP id j22mr4883970wah.5.1272304075754; Mon, \n\t26 Apr 2010 10:47:55 -0700 (PDT)\r\nX-Received: by 10.114.158.3 with HTTP; Mon, 26 Apr 2010 10:47:55 -0700 (PDT)\r\nDate: Mon, 26 Apr 2010 10:47:55 -0700\r\nMessage-ID: &lt;m2p7f5d94251004261047mf207358w59b3ec5b944b829e@...&gt;\r\nTo: samuraihistory &lt;samuraihistory@yahoogroups.com&gt;\r\nX-eGroups-Msg-Info: 1:12:0:0:0\r\nFrom: Daniel Seo &lt;DigimonDaniel0907@...&gt;\r\nSubject: thank you\r\nX-Yahoo-Group-Post: member; u=442110365; y=icooybtI6rgYucUzwB7RBhdBt0FdmLQWCh0yJS7Qwa0Wg4B_2xsc_PGmY7U\r\nX-Yahoo-Profile: digimondaniel0907\r\nContent-Type: text/plain; charset=US-ASCII\r\nContent-Transfer-Encoding: 7bit\r\nX-Yahoo-Newman-Property: groups-system\r\nX-eGroups-Approved-By: kitsuno &lt;samurai-listowner@...&gt; via web; 27 Apr 2010 02:26:08 -0000\r\n\r\nthank you  for answered my questions........\n\nyou helped my samurai research project.........\nthank you again\n\n\n[Non-text portions of this message have been removed]\n\n\n"
}