{
    "userId": 346354699,
    "authorName": "David Osborne",
    "from": "David Osborne &lt;dosborne232@...&gt;",
    "profile": "dosborne232",
    "replyTo": "LIST",
    "senderId": "QpeIykIHOOMy7R6VnlXbspnZ7Yo_16IV1YDYcrrGGpW_0zdANDJTfkIyyV4jDcvhAIuBuAAhzO0f-76NxQDy93XDBrl0W5BD_4JxMQ",
    "spamInfo": {
        "isSpam": false,
        "reason": "12"
    },
    "subject": "Amakuni Yasutsuna",
    "postDate": "1349306687",
    "msgId": 10441,
    "canDelete": false,
    "contentTrasformed": false,
    "systemMessage": false,
    "headers": {
        "messageIdInHeader": "PDEzNDkzMDY2ODcuMjYwMzAuQlBNYWlsX2hpZ2hfY2FycmllckB3ZWIxNDA5MDQubWFpbC5iZjEueWFob28uY29tPg=="
    },
    "prevInTopic": 0,
    "nextInTopic": 0,
    "prevInTime": 10440,
    "nextInTime": 10442,
    "topicId": 10441,
    "numMessagesInTopic": 1,
    "msgSnippet": "I am about to begin work on a graphic novel and plan to use Amakuni and Amakura Yasutsuna as characters in the story. I have tried to research them but all I",
    "rawEmail": "Return-Path: &lt;dosborne232@...&gt;\r\nReceived: (qmail 5464 invoked by uid 7800); 4 Oct 2012 03:06:06 -0000\r\nX-Sender: dosborne232@...\r\nX-Apparently-To: samuraihistory@yahoogroups.com\r\nX-Received: (qmail 42056 invoked from network); 3 Oct 2012 23:24:48 -0000\r\nX-Received: from unknown (98.137.34.44)\n  by m6.grp.sp2.yahoo.com with QMQP; 3 Oct 2012 23:24:48 -0000\r\nX-Received: from unknown (HELO nm36.bullet.mail.bf1.yahoo.com) (72.30.239.5)\n  by mta1.grp.sp2.yahoo.com with SMTP; 3 Oct 2012 23:24:48 -0000\r\nX-Received: from [98.139.212.148] by nm36.bullet.mail.bf1.yahoo.com with NNFMP; 03 Oct 2012 23:24:47 -0000\r\nX-Received: from [98.139.212.224] by tm5.bullet.mail.bf1.yahoo.com with NNFMP; 03 Oct 2012 23:24:47 -0000\r\nX-Received: from [127.0.0.1] by omp1033.mail.bf1.yahoo.com with NNFMP; 03 Oct 2012 23:24:47 -0000\r\nX-Yahoo-Newman-Property: ymail-3\r\nX-Yahoo-Newman-Id: 460360.61218.bm@...\r\nX-Received: (qmail 29371 invoked by uid 60001); 3 Oct 2012 23:24:47 -0000\r\nX-YMail-OSG: kcfMgzQVM1ljmIviIGCVKNC5tliLCHJswyiYtjpJSN0BiaH\n g1WakmLLrtTnxWIZZjOp6yNTSp.tI94tk_mNbZQzwmKrwzAfW_etHqxGOaqV\n TPa4JTwQrqwefeY59AaZaS3K7VEvoMdGyVu6u9gWf30X7W0c0EBESIYP.EPi\n LvTCm6pu7tsWa5qwFvON8vbr1fveMjXJieCXP36Dnuem1PK0KhW.25K6T9Gl\n bhksyssTX3rZHm5qSJX3CXpkcijwvPzw0SsJcd4gexiLf0TNpyLHKiB_ynwa\n z5irzJtwsuA_rRDFJjIKHgly2a5WYGp4vXnivaIJUs1WSiWUJRjYetxvpnjv\n kCdC07p9bqFc6DsNEvjeaPIc1MG2qrqAXqMIA_L8aBJ6V9G_1c0ud0A5T1qv\n 4UX360e5zRtBR0DbpJPQvXvRyo_Z6Pgg9Cvjo_bbPH.GAlY1x4bZ.AWa.xfU\n oqF9lp9uCUzuC8qy0WwJw9SSALt4uyFZlc0Lv0rh_cBBlYeI-\r\nX-Received: from [174.226.138.51] by web140904.mail.bf1.yahoo.com via HTTP; Wed, 03 Oct 2012 16:24:47 PDT\r\nX-Mailer: YahooMailWebService/0.8.122.442\r\nMessage-ID: &lt;1349306687.26030.BPMail_high_carrier@...&gt;\r\nDate: Wed, 3 Oct 2012 16:24:47 -0700 (PDT)\r\nTo: samuraihistory@yahoogroups.com\r\nMIME-Version: 1.0\r\nContent-Type: text/plain; charset=us-ascii\r\nX-eGroups-Msg-Info: 1:12:0:0:0\r\nFrom: David Osborne &lt;dosborne232@...&gt;\r\nSubject: Amakuni Yasutsuna\r\nX-Yahoo-Group-Post: member; u=346354699; y=OcX-mnyOO4v_ZWqszYK1SOhCFiB-_vVrPV4-zl7rNlJSKU_KjGE\r\nX-Yahoo-Profile: dosborne232\r\nX-eGroups-Approved-By: kitsuno &lt;samurai-listowner@...&gt; via email; 4 Oct 2012 03:06:06 -0000\r\n\r\n\nI am about to begin work on a graphic novel and plan to use Amakuni and Amakura Yasutsuna as characters in the story. I have tried to research them but all I find is the legend regarding the creation of the katana style sword. There is not much beyond that ad to what happened to these men for the rest of their lives. Fire anyone have any suggestions ad to where I can find more information? Thank you\n\n"
}