{
    "userId": 0,
    "authorName": "Mark Hall",
    "from": "&quot;Mark Hall&quot; &lt;markhall@...&gt;",
    "replyTo": "LIST",
    "senderId": "jsEqmC3GWEeB3-fkZziP36Lty14YH05CMjEdNpkKceWVIc30DF2yhl6BW4kM_U4eqLIFqmsWTZ6s60ZLMMd_UcimU15T",
    "spamInfo": {
        "isSpam": false,
        "reason": "0"
    },
    "subject": "NHK dramas",
    "postDate": "980421525",
    "msgId": 69,
    "canDelete": false,
    "contentTrasformed": false,
    "systemMessage": false,
    "headers": {
        "messageIdInHeader": "PDAwZTUwMWMwODZjMiRjYTZlYTQ4MCQ5NzE0ZDhjYkAwMTY4MDQzNz4="
    },
    "prevInTopic": 0,
    "nextInTopic": 78,
    "prevInTime": 68,
    "nextInTime": 70,
    "topicId": 69,
    "numMessagesInTopic": 2,
    "msgSnippet": "It was also announced tonight on the NHK news that NHK will begin production a drama based on the life of Prince Shotoku for broadcast in 2002-3 on their ",
    "rawEmail": "Return-Path: &lt;markhall@...&gt;\r\nReceived: (qmail 19115 invoked from network); 25 Jan 2001 20:09:56 -0000\r\nReceived: from unknown (10.1.10.26) by m8.onelist.org with QMQP; 25 Jan 2001 20:09:55 -0000\r\nReceived: from unknown (HELO ch.egroups.com) (10.1.10.51) by mta1 with SMTP; 25 Jan 2001 20:09:55 -0000\r\nX-eGroups-Return: markhall@...\r\nReceived: from [10.1.10.120] by ch.egroups.com with NNFMP; 25 Jan 2001 20:09:54 -0000\r\nX-eGroups-Approved-By: kitsuno@... via web; 25 Jan 2001 20:09:50 -0000\r\nX-Sender: markhall@...\r\nX-Apparently-To: samuraihistory@egroups.com\r\nReceived: (EGP: mail-7_0_2); 25 Jan 2001 11:25:16 -0000\r\nReceived: (qmail 19339 invoked from network); 25 Jan 2001 11:25:16 -0000\r\nReceived: from unknown (10.1.10.27) by m8.onelist.org with QMQP; 25 Jan 2001 11:25:16 -0000\r\nReceived: from unknown (HELO smtp01.fields.gol.com) (203.216.5.131) by mta2 with SMTP; 25 Jan 2001 11:25:15 -0000\r\nReceived: from tc-1-153.aja.gol.ne.jp ([203.216.20.153] helo=01680437) by smtp01.fields.gol.com with smtp (Magnetic Fields) id 14LkWg-0007YN-00 for &lt;samuraihistory@egroups.com&gt;; Thu, 25 Jan 2001 20:25:14 +0900\r\nMessage-ID: &lt;00e501c086c2$ca6ea480$9714d8cb@01680437&gt;\r\nTo: &lt;samuraihistory@egroups.com&gt;\r\nSubject: NHK dramas\r\nDate: Thu, 25 Jan 2001 20:18:45 +0900\r\nMIME-Version: 1.0\r\nContent-Type: text/plain; charset=&quot;iso-8859-1&quot;\r\nContent-Transfer-Encoding: 7bit\r\nX-Priority: 3\r\nX-MSMail-Priority: Normal\r\nX-Mailer: Microsoft Outlook Express 5.50.4133.2400\r\nX-MimeOLE: Produced By Microsoft MimeOLE V5.50.4133.2400\r\nX-Abuse-Complaints: abuse@...\r\nFrom: &quot;Mark Hall&quot; &lt;markhall@...&gt;\r\n\r\nIt was also announced tonight on the NHK news that\nNHK will begin production a drama based on the life of Prince Shotoku for\nbroadcast in 2002-3 on their\nHI-VISION (digital satellite) channel.\n\nLater, Mark Hall\n\n\n\n\n"
}